{
  "task_id": "CHAT-20261005-0143-NEXY-COMMITMENT-INTEGRITY-KERNEL",
  "final_status": "PASS",
  "observed_start_state": [
    "AI-CONTEXT main branch was writable",
    "คลังข้อมูลเสริม already existed",
    "supplemental tree inspection found 961 paths across 98 top-level project directories",
    "no dedicated commitment/promise/obligation/deadline/reminder/follow-up project path was observed",
    "NEXY.AI repositories were protected from mutation"
  ],
  "actions": [
    {"action":"Inspect AI-CONTEXT authority, NEXY context, verification law, and supplemental inventory","result":"Completed; selected a non-colliding commitment-integrity research direction","evidence_ref":"00_SESSION_MEMORY.md"},
    {"action":"Design NCIK architecture, lifecycle, failure model, requirements, and NEXY-compatible proposal boundary","result":"Completed","evidence_ref":"02_ARCHITECTURE.md"},
    {"action":"Implement deterministic Python reference engine and hash-chain ledger","result":"Completed","evidence_ref":"src/ncik/"},
    {"action":"Execute E1/E2 validation and adversarial testing","result":"53/53 unit/invariant tests PASS; 30/30 adversarial cases PASS; static gates PASS","evidence_ref":"evidence/final-gate.txt"}
  ],
  "verification": [
    "E0 presence: PASS for standalone project artifacts",
    "E1 static: PASS for Python compile/JSON parse/static forbidden-import checks",
    "E2 unit: PASS for 53 unit/invariant tests and 30 adversarial cases",
    "E3 integration: NOT_VERIFIED",
    "E4 end-to-end: NOT_VERIFIED",
    "E5 runtime/operational: NOT_VERIFIED",
    "E6 deployment: NOT_VERIFIED"
  ],
  "mutations": [{"target":"goif74945-crypto/AI-CONTEXT/คลังข้อมูลเสริม/CHAT-20261005-0143-NEXY-COMMITMENT-INTEGRITY-KERNEL/","change":"Create isolated supplementary project artifacts only","commit":null}],
  "blockers": [],
  "remaining": [
    "Real NEXY integration requires separate explicit authorization and E3+ evidence",
    "Production scheduler/cancellation/exactly-once semantics remain adoption proof obligations",
    "User-study, UI, deployment, and distributed-system behavior remain NOT_VERIFIED"
  ],
  "context_updates": [
    "NCIK records a proposed first-class commitment lifecycle distinct from claim truth, task scope, and execution authority leases",
    "Completion claims are bound to exact commitment fingerprint/revision and exact required evidence classes",
    "Future commitments require durable execution bindings with capability proof"
  ]
}
